num,sku,name,brand,att_set,price,deal_price,style,gender,shape,description,frame_height,frame_width,frame_colour
1,OX8081Matte Black,Oakley Ox8081 Medium (Size-51) Matte Black 01 Unisex Eyeglasses ,Oakley,Eyeglasses,6090,4872,Full Rim,Unisex,Rectangle,"b'The grandeur of Oakley OX8081 Size:51 Matte Black 01 Eyeglasses lies in its minimal feel. Frames like this make you agree that being specsy is fun. You get to play with your look and style in myriad ways. So choose this winsome pair now and start your fashion game, bang on.The grandeur of Oakley OX8081 Size:51 Matte Black 01 Eyeglasses lies in its minimal feel. Frames like this make you agree that being specsy is fun. You get to play with your look and style in myriad ways. So choose this winsome pair now and start your fashion game, bang on.Includes- Case Selvyt Care and Warranty- Care- Use mild soap solution and a clean cloth to clean the glassesWarranty- 2 Years Manufacturer WarrantyLenses shaped by hand (risk of human error)Prices vary depending on power of lensesNo warranty on lenses50% higher prices than Lenskart (on average)Limited selection of frames in stockLenses shaped by laser precision machinesSame price no matter what your power1 year warranty on all lenses50% lower prices than local optician (on average)5,000 frames in stock in a range of styles and brands'",32,133,Matte Black
2,OX8039Black,Oakley Ox8039 Medium (Size-53) Black 0153 Unisex Eyeglasses ,Oakley,Eyeglasses,6590,5272,Full Rim,Unisex,Rectangle,"b""When you're moving from a tedious day to a leisure evening, it's smart to wear specs that offer tranquility and not anxiety. Yes fashion is essential, but it's good to remember that trendy high heels are pleasing only if they are to be worn for an hour or two, while flats flatter you all day long. Likewise, Oakley OX8039 Chamfer Size:53 0153 Eyeglasses are the perfect answer when it comes to eyewear - not only do they look good on outings or occasions, you feel happy wearing them round the clock!Lenses shaped by hand (risk of human error)Prices vary depending on power of lensesNo warranty on lenses50% higher prices than Lenskart (on average)Limited selection of frames in stockLenses shaped by laser precision machinesSame price no matter what your power1 year warranty on all lenses50% lower prices than local optician (on average)5,000 frames in stock in a range of styles and brands""",32,137,Black
3,OX5126Blue Black,Oakly OX5126 Large (Size-54) Blue Black 03 Unisex Eyeglasses ,Oakley,Eyeglasses,10890,8712,Rimless,Unisex,Rectangle,"b'If you believe in minimalism, these Oakley OX5126 Medium (Size-54) Blue Black 03 Unisex Eyeglasses are perfect for you. Add a smooth look with these durable, light-weight sunglasses made from beta titanium. Three-Point fit gives an accurate optical alignment, which makes these highly reliable for a clear vision.Lenses shaped by hand (risk of human error)Prices vary depending on power of lensesNo warranty on lenses50% higher prices than Lenskart (on average)Limited selection of frames in stockLenses shaped by laser precision machinesSame price no matter what your power1 year warranty on all lenses50% lower prices than local optician (on average)5,000 frames in stock in a range of styles and brands'",33,130,Blue Black
4,OX3133Black,Oakley OX3133 02 TOP SPINNER SEMI-RIM Size:53 Eyeglasses ,Oakley,Eyeglasses,6090,4872,Half Rim,Unisex,Rectangle,"b'Steal the limelight with these designer black eyeglasses from the house of Oakley. Featuring a sturdy black, rectangle half rim frame and bifocal lenses, these eyeglasses prove to be your ideal companion in the corporate world. The Oakley OX3133 02 eyeglasses offer an enhanced vision and greater image clarity to help you see better, look better and feel better. The stainless steel frame is comfortable and light and ensures maximum comfort to the wearer, all day long.\nLenses shaped by hand (risk of human error)Prices vary depending on power of lensesNo warranty on lenses50% higher prices than Lenskart (on average)Limited selection of frames in stockLenses shaped by laser precision machinesSame price no matter what your power1 year warranty on all lenses50% lower prices than local optician (on average)5,000 frames in stock in a range of styles and brands'",30,136,Black
5,OX5128Black,Oakley OX5128 Large (Size-54) Black 04 Unisex Eyeglasses ,Oakley,Eyeglasses,10890,8712,Half Rim,Unisex,Rectangle,"b'Oakley OX5128 Large (Size-54) Black 04 Unisex EyeglassesLenses shaped by hand (risk of human error)Prices vary depending on power of lensesNo warranty on lenses50% higher prices than Lenskart (on average)Limited selection of frames in stockLenses shaped by laser precision machinesSame price no matter what your power1 year warranty on all lenses50% lower prices than local optician (on average)5,000 frames in stock in a range of styles and brands'",35,137,Black
6,OX3218Black,Oakley Ox3218 Large (Size-54) Black 01 Unisex Eyeglasses ,Oakley,Eyeglasses,7490,5992,Half Rim,Unisex,Rectangle,"b'Inspired by renowned sports eyewear, the Oakley Ox3218 Medium (Size-54) Black 01 Unisex Eyeglasses are sure to bring you a confident and sporty look. Angled lenses at the bottom and non-linear temples offer a distinct style, ideal to flaunt among peers.Lenses shaped by hand (risk of human error)Prices vary depending on power of lensesNo warranty on lenses50% higher prices than Lenskart (on average)Limited selection of frames in stockLenses shaped by laser precision machinesSame price no matter what your power1 year warranty on all lenses50% lower prices than local optician (on average)5,000 frames in stock in a range of styles and brands'",33,136,Black
7,OX8093Matte Black Blue,Oakley OX8093 Small (Size-49) Matte Black Blue 07 Unisex Eyeglasses ,Oakley,Eyeglasses,6090,4872,Full Rim,Unisex,Wayfarer,"b'Oakley OX8093 Small (Size-49) Matte Black Blue 07 Unisex EyeglassesLenses shaped by hand (risk of human error)Prices vary depending on power of lensesNo warranty on lenses50% higher prices than Lenskart (on average)Limited selection of frames in stockLenses shaped by laser precision machinesSame price no matter what your power1 year warranty on all lenses50% lower prices than local optician (on average)5,000 frames in stock in a range of styles and brands'",40,134,Matte Black Blue
8,OX31290953Black Blue,Oakley Ox31290953 Medium (Size-53) Black Blue 9 Unisex Eyeglasses ,Oakley,Eyeglasses,6090,4872,Half Rim,Unisex,Rectangle,"b'Oakley is back with this stunning half-rim pair with super-sleek temples. Those who enjoy the company of books in their leisure time must pick these Oakley OX31290953 Black Blue 09 Eyeglasses. They are ultra comfortable and soothing... perfect for long, peaceful hours of reading.Lenses shaped by hand (risk of human error)Prices vary depending on power of lensesNo warranty on lenses50% higher prices than Lenskart (on average)Limited selection of frames in stockLenses shaped by laser precision machinesSame price no matter what your power1 year warranty on all lenses50% lower prices than local optician (on average)5,000 frames in stock in a range of styles and brands'",28,140,Black Blue
9,OX8081Matte Black,Oakley Ox8081 Medium (Size-53) Matte Black 153 Unisex Eyeglasses ,Oakley,Eyeglasses,6090,4872,Full Rim,Unisex,Rectangle,"b'This is one chashma style that can never go wrong, no matter what your wear. Oakley OX8081 Size:53 Matte Black 0153 Eyeglasses have a comfortable silhouette and contemporary touch and feel. The qualities of this pair will never disappoint you, akin to a glazed doughnut that makes us happy no matter what day and time it is!Lenses shaped by hand (risk of human error)Prices vary depending on power of lensesNo warranty on lenses50% higher prices than Lenskart (on average)Limited selection of frames in stockLenses shaped by laser precision machinesSame price no matter what your power1 year warranty on all lenses50% lower prices than local optician (on average)5,000 frames in stock in a range of styles and brands'",32,138,Matte Black
10,0OX5142Black,Oakley 0OX5142 Small (Size-54) Black 01 Unisex Eyeglasses ,Oakley,Eyeglasses,10890,8712,Half Rim,Unisex,Aviator,"b'The Oakley 0OX5142 Small (Size-54) Black 01 Unisex Eyeglasses are aviator-style glasses that ooze sophistication and sleekness. The rims are black in color with an artsy metallic detail embedded in the hinges. The frames are made of stainless steel so they are allergy-safe and the issue of corrosion would not be there. If you want to sport fashionable yet smart spectacles for school and daily wear, these are definitely the ones to go for. You can wear them at casual or formal events, and dress up or dress down with them depending upon your mood.Lenses shaped by hand (risk of human error)Prices vary depending on power of lensesNo warranty on lenses50% higher prices than Lenskart (on average)Limited selection of frames in stockLenses shaped by laser precision machinesSame price no matter what your power1 year warranty on all lenses50% lower prices than local optician (on average)5,000 frames in stock in a range of styles and brands'",45,137,Black
11,0OX5142Brown Black,Oakley 0OX5142 Small (Size-54) Brown Black 03 Unisex Eyeglasses ,Oakley,Eyeglasses,10890,8712,Half Rim,Unisex,Aviator,"b'An emblem of sophistication, these half-rimmed titanium Oakley 0OX5142 Small (Size-54) Brown Black 03 Unisex Eyeglasses make a subtle style statement. The best part - these rectangular eye frames go well with all kinds of outfits.Lenses shaped by hand (risk of human error)Prices vary depending on power of lensesNo warranty on lenses50% higher prices than Lenskart (on average)Limited selection of frames in stockLenses shaped by laser precision machinesSame price no matter what your power1 year warranty on all lenses50% lower prices than local optician (on average)5,000 frames in stock in a range of styles and brands'",45,136,Brown Black
12,OX5113Blue Black,Oakley OX5113 Large (Size-54) Blue Black 04 Unisex Eyeglasses ,Oakley,Eyeglasses,9390,7512,Half Rim,Unisex,Rectangle,"b'Stand out with these Oakley OX5113 Large (Size-54) Black 01 ,Unisex Eyeglasses. The sleek temples followed by Nanowire hinges give these rectangular half-rimmed silhouettes a sporty look. Make no compromise on comfort with adjustable air-cushioned nose pads and the firm grip of unobtainium earsocks.Lenses shaped by hand (risk of human error)Prices vary depending on power of lensesNo warranty on lenses50% higher prices than Lenskart (on average)Limited selection of frames in stockLenses shaped by laser precision machinesSame price no matter what your power1 year warranty on all lenses50% lower prices than local optician (on average)5,000 frames in stock in a range of styles and brands'",33,132,Blue Black
13,OX8047Grey Transparent,Oakley Ox8047 Medium (Size-52) Grey Transparent 02 Unisex Eyeglasses ,Oakley,Eyeglasses,6090,4872,Full Rim,Unisex,Rectangle,"b'A trendy style inspired from the past that reflects the perfect blend of vintage influence with the urban touch. Bring home these marvellous rectangular frames from Oakley and pep up your personality with charisma and dynamism. Show your attitude to the fullest to the world and let the people envy you for the unique style sense you carry in these retro-frames. Live a life never lived before, in style!\n\n3 DECIMAL TESTED\nEach eyeglass manufactured by Lenskart goes through 3 decimal testing (3D testing) performed by MEI machines. For the first time in India, this robotic technology from Germany creates micro-precision lenses which are accurate to 3 decimal places. No rounding off.\nMADE BY ROBOTS\n\n\nLenses are cut by robotic machines using German technologies leaving no room for human error.\nEdging of lenses by MEI machines that provide lenses accurate to 3 decimal places\nAspheric, Anti-Glare & Super Hydrophobic Lens with Robotic Inspection\n\n\nFRESH OUT OF THE OVEN\nNo middlemen simply means no extra cost. Our products come straight from us, the manufacturer, to you hence eliminating all extra costs added by layers of middlemen. So, you pay the lowest cost for the best quality.\nLENSKART VS LOCAL OPTICIAN\n\n\nAccuracy : Our lenses are accurate to 3 decimal places, however local opticians usually round the power off.\nQuality : Imported material with 7-layer polishing material.\nTrust : No local optician has 14 day return policy and 1 year warranty like we do\nVariety : The largest variety under one roof in India : 3000+ styles Imported material with 7-layer polishing material.\nValue : Unbeatable prices for the best quality\n\n\nLenses shaped by hand (risk of human error)Prices vary depending on power of lensesNo warranty on lenses50% higher prices than Lenskart (on average)Limited selection of frames in stockLenses shaped by laser precision machinesSame price no matter what your power1 year warranty on all lenses50% lower prices than local optician (on average)5,000 frames in stock in a range of styles and brands'",32,,Grey Transparent
14,0OX5142Brown Black,Oakley 0OX5142 Small (Size-54) Brown Black 03 Unisex Eyeglasses ,Oakley,Eyeglasses,10890,8712,Half Rim,Unisex,Aviator,"b'An emblem of sophistication, these half-rimmed titanium Oakley 0OX5142 Small (Size-54) Brown Black 03 Unisex Eyeglasses make a subtle style statement. The best part - these rectangular eye frames go well with all kinds of outfits.Lenses shaped by hand (risk of human error)Prices vary depending on power of lensesNo warranty on lenses50% higher prices than Lenskart (on average)Limited selection of frames in stockLenses shaped by laser precision machinesSame price no matter what your power1 year warranty on all lenses50% lower prices than local optician (on average)5,000 frames in stock in a range of styles and brands'",45,136,Brown Black
15,OX5113Blue Black,Oakley OX5113 Large (Size-54) Blue Black 04 Unisex Eyeglasses ,Oakley,Eyeglasses,9390,7512,Half Rim,Unisex,Rectangle,"b'Stand out with these Oakley OX5113 Large (Size-54) Black 01 ,Unisex Eyeglasses. The sleek temples followed by Nanowire hinges give these rectangular half-rimmed silhouettes a sporty look. Make no compromise on comfort with adjustable air-cushioned nose pads and the firm grip of unobtainium earsocks.Lenses shaped by hand (risk of human error)Prices vary depending on power of lensesNo warranty on lenses50% higher prices than Lenskart (on average)Limited selection of frames in stockLenses shaped by laser precision machinesSame price no matter what your power1 year warranty on all lenses50% lower prices than local optician (on average)5,000 frames in stock in a range of styles and brands'",33,132,Blue Black
16,OX8047Grey Transparent,Oakley Ox8047 Medium (Size-52) Grey Transparent 02 Unisex Eyeglasses ,Oakley,Eyeglasses,6090,4872,Full Rim,Unisex,Rectangle,"b'A trendy style inspired from the past that reflects the perfect blend of vintage influence with the urban touch. Bring home these marvellous rectangular frames from Oakley and pep up your personality with charisma and dynamism. Show your attitude to the fullest to the world and let the people envy you for the unique style sense you carry in these retro-frames. Live a life never lived before, in style!\n\n3 DECIMAL TESTED\nEach eyeglass manufactured by Lenskart goes through 3 decimal testing (3D testing) performed by MEI machines. For the first time in India, this robotic technology from Germany creates micro-precision lenses which are accurate to 3 decimal places. No rounding off.\nMADE BY ROBOTS\n\n\nLenses are cut by robotic machines using German technologies leaving no room for human error.\nEdging of lenses by MEI machines that provide lenses accurate to 3 decimal places\nAspheric, Anti-Glare & Super Hydrophobic Lens with Robotic Inspection\n\n\nFRESH OUT OF THE OVEN\nNo middlemen simply means no extra cost. Our products come straight from us, the manufacturer, to you hence eliminating all extra costs added by layers of middlemen. So, you pay the lowest cost for the best quality.\nLENSKART VS LOCAL OPTICIAN\n\n\nAccuracy : Our lenses are accurate to 3 decimal places, however local opticians usually round the power off.\nQuality : Imported material with 7-layer polishing material.\nTrust : No local optician has 14 day return policy and 1 year warranty like we do\nVariety : The largest variety under one roof in India : 3000+ styles Imported material with 7-layer polishing material.\nValue : Unbeatable prices for the best quality\n\n\nLenses shaped by hand (risk of human error)Prices vary depending on power of lensesNo warranty on lenses50% higher prices than Lenskart (on average)Limited selection of frames in stockLenses shaped by laser precision machinesSame price no matter what your power1 year warranty on all lenses50% lower prices than local optician (on average)5,000 frames in stock in a range of styles and brands'",32,,Grey Transparent
17,0OX5143Black,Oakley 0OX5143 Large (Size-51) Black 01 Unisex Eyeglasses ,Oakley,Eyeglasses,10890,8712,Rimless,Unisex,Round,"b'Oakley 0OX5143 Large (Size-51) Black 01 Unisex EyeglassesLenses shaped by hand (risk of human error)Prices vary depending on power of lensesNo warranty on lenses50% higher prices than Lenskart (on average)Limited selection of frames in stockLenses shaped by laser precision machinesSame price no matter what your power1 year warranty on all lenses50% lower prices than local optician (on average)5,000 frames in stock in a range of styles and brands'",47,,Black
18,OX3133Matte Gunmetal,Oakley OX3133 TOP SPINNER SEMI-RIM Size:53 O3 Eyeglasses ,Oakley,Eyeglasses,6090,4872,Half Rim,Unisex,Rectangle,"b'Weightless Oakley OX3133 TOP SPINNER SEMI-RIM Size:53 O3 Eyeglasses are ideal for a polished, professional look. And the half-rimmed matte gunmetal toned frames are versatile when it comes to matching them with your outfit.Lenses shaped by hand (risk of human error)Prices vary depending on power of lensesNo warranty on lenses50% higher prices than Lenskart (on average)Limited selection of frames in stockLenses shaped by laser precision machinesSame price no matter what your power1 year warranty on all lenses50% lower prices than local optician (on average)5,000 frames in stock in a range of styles and brands'",29,135,Matte Gunmetal
19,OX8093Matte Grey Transparent Black,Oakley OX8093 Small (Size-49) Matte Grey Transparent Black 02 Unisex Eyeglasses ,Oakley,Eyeglasses,6090,4872,Full Rim,Unisex,Wayfarer,"b'Oakley OX8093 Small (Size-49) Matte Grey Transparent Black 02 Unisex EyeglassesLenses shaped by hand (risk of human error)Prices vary depending on power of lensesNo warranty on lenses50% higher prices than Lenskart (on average)Limited selection of frames in stockLenses shaped by laser precision machinesSame price no matter what your power1 year warranty on all lenses50% lower prices than local optician (on average)5,000 frames in stock in a range of styles and brands'",40,135,Matte Grey Transparent Black
20,OX5113Black,Oakley OX5113 Large (Size-54) Black 01 Unisex Eyeglasses ,Oakley,Eyeglasses,9390,7512,Half Rim,Unisex,Rectangle,"b'Stand out with these Oakley OX5113 Large (Size-54) Black 01 Unisex Eyeglasses. The sleek temples followed by Nanowire hinges give these rectangular half-rimmed silhouettes a sporty look. Make no compromise on comfort with adjustable air-cushioned nose pads and the firm grip of unobtainium earsocks.Lenses shaped by hand (risk of human error)Prices vary depending on power of lensesNo warranty on lenses50% higher prices than Lenskart (on average)Limited selection of frames in stockLenses shaped by laser precision machinesSame price no matter what your power1 year warranty on all lenses50% lower prices than local optician (on average)5,000 frames in stock in a range of styles and brands'",33,136,Black
21,CARRERA 206/GGunmetal Black,Carrera 206/G Small (Size-48) Tortoise Gunmetal Black 581 Unisex Eyeglasses ,Carrera,Eyeglasses,7900,5530,Full Rim,Unisex,Round,"b'Carrera 206/G Small (Size-48) Tortoise Gunmetal Black 581 Unisex Eyeglasses with stainless steel temples sits around the head as securely as a headband and bestow you with a comfortable wearing experience.Lenses shaped by hand (risk of human error)Prices vary depending on power of lensesNo warranty on lenses50% higher prices than Lenskart (on average)Limited selection of frames in stockLenses shaped by laser precision machinesSame price no matter what your power1 year warranty on all lenses50% lower prices than local optician (on average)5,000 frames in stock in a range of styles and brands'",42,141,Gunmetal Black
22,CARRERA 157/VGolden Tortoise,Carrera 157/V Small (Size-48) Golden Black Golden Tortoise RHL Unisex Eyeglasses ,Carrera,Eyeglasses,7400,5180,Full Rim,Unisex,Round,"b""It's time to give your looks an uber-upgrade with Carrera 157/V Small (Size-48) Golden Black Golden Tortoise RHL Unisex Eyeglasses.Lenses shaped by hand (risk of human error)Prices vary depending on power of lensesNo warranty on lenses50% higher prices than Lenskart (on average)Limited selection of frames in stockLenses shaped by laser precision machinesSame price no matter what your power1 year warranty on all lenses50% lower prices than local optician (on average)5,000 frames in stock in a range of styles and brands""",45,134,Golden Tortoise
23,CARRERA 159/V/FBlack,Carrera 159/V/F Small (Size-50) Silver Black 807 Unisex Eyeglasses ,Carrera,Eyeglasses,7400,5180,Full Rim,Unisex,Rectangle,"b'Carrera 159/V/F Small (Size-50) Silver Black 807 Unisex Eyeglasses are designed for the metropolitan creatives who strives to look moralistic and proper at work.Lenses shaped by hand (risk of human error)Prices vary depending on power of lensesNo warranty on lenses50% higher prices than Lenskart (on average)Limited selection of frames in stockLenses shaped by laser precision machinesSame price no matter what your power1 year warranty on all lenses50% lower prices than local optician (on average)5,000 frames in stock in a range of styles and brands'",43,138,Black
24,CARRERA 161/V/FBlack,Carrera 161/V/F Small (Size-49) Silver Black 807 Unisex Eyeglasses ,Carrera,Eyeglasses,7900,5530,Full Rim,Unisex,Club Master,"b'Want to look eclectic at gatherings? Then opt these Carrera 161/V/F Small (Size-49) Silver Black 807 Unisex Eyeglasses.Lenses shaped by hand (risk of human error)Prices vary depending on power of lensesNo warranty on lenses50% higher prices than Lenskart (on average)Limited selection of frames in stockLenses shaped by laser precision machinesSame price no matter what your power1 year warranty on all lenses50% lower prices than local optician (on average)5,000 frames in stock in a range of styles and brands'",42,137,Black
25,CA6630Black,Carrera CA6630 Large (Size-54) Black 003 Unisex Eyeglasses ,Carrera,Eyeglasses,6900,4830,Full Rim,Unisex,Rectangle,"b'Carrera CA6630 Large (Size-54) Black 003 Unisex EyeglassesLenses shaped by hand (risk of human error)Prices vary depending on power of lensesNo warranty on lenses50% higher prices than Lenskart (on average)Limited selection of frames in stockLenses shaped by laser precision machinesSame price no matter what your power1 year warranty on all lenses50% lower prices than local optician (on average)5,000 frames in stock in a range of styles and brands'",33,135,Black
26,2002T/VMatte Black,Carrera 2002T/V Small (Size-51) Matte Black 003 Unisex Eyeglasses ,Carrera,Eyeglasses,4900,3430,Full Rim,Unisex,Aviator,"b'Carrera 2002T/V Small (Size-51) Matte Black 003 Unisex EyeglassesLenses shaped by hand (risk of human error)Prices vary depending on power of lensesNo warranty on lenses50% higher prices than Lenskart (on average)Limited selection of frames in stockLenses shaped by laser precision machinesSame price no matter what your power1 year warranty on all lenses50% lower prices than local optician (on average)5,000 frames in stock in a range of styles and brands'",43,,Matte Black
27,CA6645Tortoise,Carrera CA6645 Small (Size-47) Black Golden Tortoise 2M2 Unisex Eyeglasses ,Carrera,Eyeglasses,4400,3080,Full Rim,Unisex,Round,"b'There are days when you just do no\xc2\x99t feel the need to dress up for work or other things and then there are days when you go all out with your makeup, the dress, the accessories etc. But majority of the time, you wish you had a genie to prep you up for the day! (I know I do) These Carrera CA6645 Small (Size-47) Black Golden Tortoise 2M2 Unisex Eyeglasses are perfect for the days you want to go low-key with your outfit and makeup, but still want to look stylish.Lenses shaped by hand (risk of human error)Prices vary depending on power of lensesNo warranty on lenses50% higher prices than Lenskart (on average)Limited selection of frames in stockLenses shaped by laser precision machinesSame price no matter what your power1 year warranty on all lenses50% lower prices than local optician (on average)5,000 frames in stock in a range of styles and brands'",42,136,Tortoise
