num,sku,name,brand,att_set,price,deal_price,style,gender,shape,description,frame_height,frame_width,frame_colour
53,VO4140Golden Tortoise,Vogue VO4140 Large (Size-53) Golden Tortoise 5078 Women Eyeglasses ,Vogue,Eyeglasses,6890,5512,Full Rim,Women,Square,"b'These Vogue VO4140 Large (Size-53) Golden Tortoise 5078 Women Eyeglasses will remind you of Zooey Deschanel\xe2\x80\x99s popular geek-chic look. Influenced heavily by the cat-eye spectacles\xe2\x80\x99 design, these rectangular specs will spice up your everyday outfits. Lenses shaped by hand (risk of human error)Prices vary depending on power of lensesNo warranty on lenses50% higher prices than Lenskart (on average)Limited selection of frames in stockLenses shaped by laser precision machinesSame price no matter what your power1 year warranty on all lenses50% lower prices than local optician (on average)5,000 frames in stock in a range of styles and brands'",48,132,Golden Tortoise
54,VO4140Black,Vogue VO4140 Large (Size-53) Black 352 Unisex Eyeglasses ,Vogue,Eyeglasses,6890,5512,Full Rim,Unisex,Square,"b'Get a hip look with Vogue VO4140 Large (Size-53) Black 352 Unisex Eyeglasses. The oversized frames are thin conveying elegance in simplicity. Ideal for oval and round-shaped faces, these will complement both formal and casual outfits.Lenses shaped by hand (risk of human error)Prices vary depending on power of lensesNo warranty on lenses50% higher prices than Lenskart (on average)Limited selection of frames in stockLenses shaped by laser precision machinesSame price no matter what your power1 year warranty on all lenses50% lower prices than local optician (on average)5,000 frames in stock in a range of styles and brands'",48,134,Black
55,VO5224Maroon Transparent,Vogue Maroon Transparent Full Rim Rectangle Medium (Size-51) Vogue VO5224 - 2636 Eyeglasses ,Vogue,Eyeglasses,5490,4392,Full Rim,Women,Rectangle,"b'Minimal yet elegantly designed are the Vogue Maroon Transparent Full Rim Rectangle Medium (Size-51) Vogue VO5224 - 2636 Eyeglasses. These rectangle-shaped eyeglasses have a regal feel that is no doubt because of the choice of color on the frames. The rims and ear pieces are of transparent maroon color and are made of acetate, while the stainless steel temples are gold in color. These spectacles are incredibly light in weight so they would also be comfortable to be worn daily. You can wear them with trendy trousers or with your formal skirts to give a professional yet stylish edge to your work clothes. You can even pair them with BLU lenses by Lenskart that can reduce the strain caused on your eyes by blue light emitted from the screens of computers and smartphones.Lenses shaped by hand (risk of human error)Prices vary depending on power of lensesNo warranty on lenses50% higher prices than Lenskart (on average)Limited selection of frames in stockLenses shaped by laser precision machinesSame price no matter what your power1 year warranty on all lenses50% lower prices than local optician (on average)5,000 frames in stock in a range of styles and brands'",36,133,Maroon Transparent
56,VO5226Black,Vogue VO5226 Medium (Size-50) Black w44 Women's Eyeglasses ,Vogue,Eyeglasses,4990,3992,Full Rim,Women,Hexagonal,"b""Want to be the center of attraction? The hexagon-shaped Vogue VO5226 Small (Size-50) Black w44 Women's Eyeglasses are sure to do that for you. These fully rimmed black eyeglasses for girls are an attractive blend of drama and sportiness.Lenses shaped by hand (risk of human error)Prices vary depending on power of lensesNo warranty on lenses50% higher prices than Lenskart (on average)Limited selection of frames in stockLenses shaped by laser precision machinesSame price no matter what your power1 year warranty on all lenses50% lower prices than local optician (on average)5,000 frames in stock in a range of styles and brands""",44,134,Black
57,VO5232Golden Brown,Vogue VO5232 Small (Size-50) Brown Gold DUen Brown 1916 Women's Eyeglasses ,Vogue,Eyeglasses,5490,4392,Full Rim,Women,Cat Eye,"b""Add glam to your look with these sturdy Vogue VO5232 Small (Size-50) Brown Gold DUen Brown 1916 Women's Eyeglasses. The non-linear brown shaded designs on the temples are sure to incite your peers' envy. Ideal for oval shaped faces, you may pair these wide frames with denim jackets and jeans. Lenses shaped by hand (risk of human error)Prices vary depending on power of lensesNo warranty on lenses50% higher prices than Lenskart (on average)Limited selection of frames in stockLenses shaped by laser precision machinesSame price no matter what your power1 year warranty on all lenses50% lower prices than local optician (on average)5,000 frames in stock in a range of styles and brands""",45,132,Golden Brown
58,VO5232Black Grey,Vogue VO5232 Small (Size-50) Black Grey 2385 Women's Eyeglasses ,Vogue,Eyeglasses,5490,4392,Full Rim,Women,Cat Eye,"b""Looking for glasses that have a unique yet simple design? The Vogue VO5232 Small (Size-50) Black Grey 2385 Women's Eyeglasses would definitely be the choice for you. These cat-eye style frames have a clean design but the most unique feature would have to be the use of color. The black-colored rims and combination of grey and black color on the temples give it a sophisticated edge. You can now pair them with BLU lenses by Lenskart that can help reduce strain on the eyes caused by blue light emitted from laptops and smartphones. You can also style these specs with white-colored shirts to add to the smart look they already convey.Lenses shaped by hand (risk of human error)Prices vary depending on power of lensesNo warranty on lenses50% higher prices than Lenskart (on average)Limited selection of frames in stockLenses shaped by laser precision machinesSame price no matter what your power1 year warranty on all lenses50% lower prices than local optician (on average)5,000 frames in stock in a range of styles and brands""",45,132,Black Grey
59,VO5240Brown,Vogue VO5240 Medium (Size-51) Brown w656 Women's Eyeglasses ,Vogue,Eyeglasses,6390,4473,Full Rim,Women,Cat Eye,"b""Vogue VO5240 Medium (Size-51) Brown w656 Women's EyeglassesLenses shaped by hand (risk of human error)Prices vary depending on power of lensesNo warranty on lenses50% higher prices than Lenskart (on average)Limited selection of frames in stockLenses shaped by laser precision machinesSame price no matter what your power1 year warranty on all lenses50% lower prices than local optician (on average)5,000 frames in stock in a range of styles and brands""",32,,Brown
60,VO5226Tortoise,Vogue VO5226 Medium (Size-50) Brown Tortoise 2386 Women's Eyeglasses ,Vogue,Eyeglasses,4990,3992,Full Rim,Women,Hexagonal,"b""Vogue VO5226 Medium (Size-50) Brown Tortoise 2386 Women's EyeglassesLenses shaped by hand (risk of human error)Prices vary depending on power of lensesNo warranty on lenses50% higher prices than Lenskart (on average)Limited selection of frames in stockLenses shaped by laser precision machinesSame price no matter what your power1 year warranty on all lenses50% lower prices than local optician (on average)5,000 frames in stock in a range of styles and brands""",44,135,Tortoise
61,VO5224Gunmetal,Vogue VO5224 Medium (Size-53) Black Gunmetal 2385 Women's Eyeglasses ,Vogue,Eyeglasses,5490,4392,Full Rim,Women,Rectangle,"b""When in doubt, choose black. These rectangular Vogue VO5224 Medium (Size-53) Black Gunmetal 2385 Women's Eyeglasses are perfect for an elegant professional look. Just pair them with trousers and a printed shirt. The best part - these fully rimmed eyeglasses for girls complement most face cuts.Lenses shaped by hand (risk of human error)Prices vary depending on power of lensesNo warranty on lenses50% higher prices than Lenskart (on average)Limited selection of frames in stockLenses shaped by laser precision machinesSame price no matter what your power1 year warranty on all lenses50% lower prices than local optician (on average)5,000 frames in stock in a range of styles and brands""",38,136,Gunmetal
62,VO5262Black,Vogue VO5262 Medium (Size-51) Black W44 Women Eyeglasses ,Vogue,Eyeglasses,3890,3112,Full Rim,Women,Cat Eye,"b'The cat-eye Vogue VO5262 Medium (Size-51) Black W44 Women Eyeglasses bring a playful twist to conventional rectangular shaped eyeglasses. Versatile enough to pair with all attires due to their bold black colour, these look best on square and diamond faces.Lenses shaped by hand (risk of human error)Prices vary depending on power of lensesNo warranty on lenses50% higher prices than Lenskart (on average)Limited selection of frames in stockLenses shaped by laser precision machinesSame price no matter what your power1 year warranty on all lenses50% lower prices than local optician (on average)5,000 frames in stock in a range of styles and brands'",33,,Black
63,VO5042Blue Gunmetal,Vogue VO5042 Medium (Size-53) Blue Gunmetal 2395 Women Eyeglasses ,Vogue,Eyeglasses,3590,2872,Full Rim,Women,Cat Eye,"b'When you want to look nifty yet effortlessly minimalistic, follow Jennifer Aniston\xe2\x80\x99s choice of frames. Try these lightweight Vogue VO5042 Medium (Size-53) Blue Gunmetal 2395 Women Eyeglasses for a casual-yet-modish vibe. These eyeglasses for girls look best on oval, round and heart face shapes. Lenses shaped by hand (risk of human error)Prices vary depending on power of lensesNo warranty on lenses50% higher prices than Lenskart (on average)Limited selection of frames in stockLenses shaped by laser precision machinesSame price no matter what your power1 year warranty on all lenses50% lower prices than local optician (on average)5,000 frames in stock in a range of styles and brands'",34,,Blue Gunmetal
64,VO4131Golden Blue,Vogue VO4131 Small (Size-48) Golden Blue 848 Women Eyeglasses ,Vogue,Eyeglasses,5990,4792,Full Rim,Women,Hexagonal,"b'These Vogue VO4131 Small (Size-48) Golden Blue 848 Women Eyeglasses come with unique detailing on their hexagonal frames. Lightweight with a bold interplay of golden and blue colours, these specs are for those who want to give their minimalist fashion sense a new meaning. Lenses shaped by hand (risk of human error)Prices vary depending on power of lensesNo warranty on lenses50% higher prices than Lenskart (on average)Limited selection of frames in stockLenses shaped by laser precision machinesSame price no matter what your power1 year warranty on all lenses50% lower prices than local optician (on average)5,000 frames in stock in a range of styles and brands'",41,127,Golden Blue
65,VO4131Golden Black,Vogue VO4131 Small (Size-48) Golden Black 280 Women Eyeglasses ,Vogue,Eyeglasses,5990,4792,Full Rim,Women,Hexagonal,"b'These Vogue VO4131 Small (Size-48) Golden Black 280 Women Eyeglasses come with unique detailing on their hexagonal frames. Lightweight with a bold interplay of golden and black colours, these specs are for those who want to give their minimalist fashion sense a new meaning. Lenses shaped by hand (risk of human error)Prices vary depending on power of lensesNo warranty on lenses50% higher prices than Lenskart (on average)Limited selection of frames in stockLenses shaped by laser precision machinesSame price no matter what your power1 year warranty on all lenses50% lower prices than local optician (on average)5,000 frames in stock in a range of styles and brands'",41,128,Golden Black
66,VO4125Brown,Vogue VO4125 Medium (Size-51) Brown Purple Brown 5115 Women Eyeglasses ,Vogue,Eyeglasses,3890,3112,Full Rim,Women,Cat Eye,"b'These trendy Vogue VO4125 Medium (Size-51) Brown Purple Brown 5115 Women Eyeglasses will raise your minimalist style quotient. Drawing from oval spectacles design, these cat-eye frames will complement both casuals and professional outfits.Lenses shaped by hand (risk of human error)Prices vary depending on power of lensesNo warranty on lenses50% higher prices than Lenskart (on average)Limited selection of frames in stockLenses shaped by laser precision machinesSame price no matter what your power1 year warranty on all lenses50% lower prices than local optician (on average)5,000 frames in stock in a range of styles and brands'",42,132,Brown
67,VO5247Black Gunmetal,Vogue VO5247 Small (Size-49) Black Gunmetal W44 Women Eyeglasses ,Vogue,Eyeglasses,3890,3112,Full Rim,Women,Round,"b'These round-style spectacles have a posh vibe because of the use of color and the simplistic design. The rims are in black color and what makes the design on the Vogue VO5247 Small (Size-49) Black Gunmetal W44 Women Eyeglasses unique would have to be the use of gunmetal-colored stainless steel temples with end pieces that match the rims. The stainless steel material used for the frames also adds a refined tone to the overall feel of the spectacles. You can wear this slick pair of glasses with your girly shirts and linen pants to flaunt a fresh and comfortable look for your day. You can now use BLU lenses by Lenskart to help reduce the strain on your eyes that heavy use of computers and smartphones usually causes.Lenses shaped by hand (risk of human error)Prices vary depending on power of lensesNo warranty on lenses50% higher prices than Lenskart (on average)Limited selection of frames in stockLenses shaped by laser precision machinesSame price no matter what your power1 year warranty on all lenses50% lower prices than local optician (on average)5,000 frames in stock in a range of styles and brands'",43,,Black Gunmetal
68,VO4108Copper,Vogue VO4108 Small (Size-49) Copper 5078 Women's Eyeglasses ,Vogue,Eyeglasses,5990,4792,Full Rim,Women,Cat Eye,"b""Because of the cat-eye style frames of the Vogue VO4108 Small (Size-49) Copper 5078 Women's Eyeglasses, there is a tone of sophistication. The use of copper color for the rims and temples made of stainless steel material adds a luxurious element to them as well. They are impact-resistant and comfortable because of the stainless steel material used for their construction. You can pair them with your favorite blazers and casual t-shirts to convey a comfortable-chic overall style. You have the option of using BLU lenses that can help in reducing the strain caused by blue light emissions from computers and smartphones.Lenses shaped by hand (risk of human error)Prices vary depending on power of lensesNo warranty on lenses50% higher prices than Lenskart (on average)Limited selection of frames in stockLenses shaped by laser precision machinesSame price no matter what your power1 year warranty on all lenses50% lower prices than local optician (on average)5,000 frames in stock in a range of styles and brands""",44,127,Copper
69,VO2950Black,Vogue Black Transparent Black Full Rim Rectangle Medium (Size-51) Vogue VO2950 - W827 Eyeglasses ,Vogue,Eyeglasses,3890,3112,Full Rim,Women,Rectangle,"b'Rectangular frames have been in fashion since ever. Pick these Vogue Black Transparent Black Full Rim Rectangle Medium (Size-51) Vogue VO2950 - W827 Eyeglasses for their unique transparent inner frames. The curvy fronts in the black tone make them look minimal and are perfect for those with diamond-shaped faces. Lenses shaped by hand (risk of human error)Prices vary depending on power of lensesNo warranty on lenses50% higher prices than Lenskart (on average)Limited selection of frames in stockLenses shaped by laser precision machinesSame price no matter what your power1 year warranty on all lenses50% lower prices than local optician (on average)5,000 frames in stock in a range of styles and brands'",36,132,Black
70,VO5223Maroon Transparent Golden,Vogue Maroon Transparent Golden Full Rim Round Medium (Size-50) Vogue VO5223 - 2636 Eyeglasses ,Vogue,Eyeglasses,5490,4392,Full Rim,Women,Round,"b'A favoured choice of celebrities in the 1970s, round frames have made a comeback. Get the Vogue Maroon Transparent Golden Full Rim Round Small (Size-50) Vogue VO5223 - 2636 Eyeglasses for their curvy nose bridge and funky maroon-toned frames. These eyeglasses for girls look good with both formals and casuals.Lenses shaped by hand (risk of human error)Prices vary depending on power of lensesNo warranty on lenses50% higher prices than Lenskart (on average)Limited selection of frames in stockLenses shaped by laser precision machinesSame price no matter what your power1 year warranty on all lenses50% lower prices than local optician (on average)5,000 frames in stock in a range of styles and brands'",43,129,Maroon Transparent Golden
71,VO5120Black,Vogue VO5120 Medium (Size-52) Black W44 Women Eyeglasses ,Vogue,Eyeglasses,3390,2712,Full Rim,Women,Cat Eye,"b""Unparalleled style attached with Vogue VO5120 Size-52 W44 Black Cat Eye Women's Eyeglasses make these optics a high-fashion accessory. Women, equally voguish, will never let this pair slip from their hand - just the way an explorer never leaves the opportunity to travel, irrespective of the destination.Lenses shaped by hand (risk of human error)Prices vary depending on power of lensesNo warranty on lenses50% higher prices than Lenskart (on average)Limited selection of frames in stockLenses shaped by laser precision machinesSame price no matter what your power1 year warranty on all lenses50% lower prices than local optician (on average)5,000 frames in stock in a range of styles and brands""",38,131,Black
72,VO4095Black Gunmetal,Vogue VO4095 Medium (Size-53) Black Gunmetal 352 Women Eyeglasses ,Vogue,Eyeglasses,6390,5112,Half Rim,Women,Cat Eye,"b'Redefine sophistication with Vogue VO4095 Medium (Size-53) Black Gunmetal 352 Women Eyeglasses. Offering a distinct look due to the striking colourway on the top halves, this trendy pair will be your go-to accessory when you wear formal skirts. Lenses shaped by hand (risk of human error)Prices vary depending on power of lensesNo warranty on lenses50% higher prices than Lenskart (on average)Limited selection of frames in stockLenses shaped by laser precision machinesSame price no matter what your power1 year warranty on all lenses50% lower prices than local optician (on average)5,000 frames in stock in a range of styles and brands'",38,,Black Gunmetal
73,VO5262Black,Vogue VO5262 Medium (Size-51) Black W44 Women Eyeglasses ,Vogue,Eyeglasses,3890,3112,Full Rim,Women,Cat Eye,"b'The cat-eye Vogue VO5262 Medium (Size-51) Black W44 Women Eyeglasses bring a playful twist to conventional rectangular shaped eyeglasses. Versatile enough to pair with all attires due to their bold black colour, these look best on square and diamond faces.Lenses shaped by hand (risk of human error)Prices vary depending on power of lensesNo warranty on lenses50% higher prices than Lenskart (on average)Limited selection of frames in stockLenses shaped by laser precision machinesSame price no matter what your power1 year warranty on all lenses50% lower prices than local optician (on average)5,000 frames in stock in a range of styles and brands'",33,,Black
74,VO5042Blue Gunmetal,Vogue VO5042 Medium (Size-53) Blue Gunmetal 2395 Women Eyeglasses ,Vogue,Eyeglasses,3590,2872,Full Rim,Women,Cat Eye,"b'When you want to look nifty yet effortlessly minimalistic, follow Jennifer Aniston\xe2\x80\x99s choice of frames. Try these lightweight Vogue VO5042 Medium (Size-53) Blue Gunmetal 2395 Women Eyeglasses for a casual-yet-modish vibe. These eyeglasses for girls look best on oval, round and heart face shapes. Lenses shaped by hand (risk of human error)Prices vary depending on power of lensesNo warranty on lenses50% higher prices than Lenskart (on average)Limited selection of frames in stockLenses shaped by laser precision machinesSame price no matter what your power1 year warranty on all lenses50% lower prices than local optician (on average)5,000 frames in stock in a range of styles and brands'",34,,Blue Gunmetal
75,VO4131Golden Blue,Vogue VO4131 Small (Size-48) Golden Blue 848 Women Eyeglasses ,Vogue,Eyeglasses,5990,4792,Full Rim,Women,Hexagonal,"b'These Vogue VO4131 Small (Size-48) Golden Blue 848 Women Eyeglasses come with unique detailing on their hexagonal frames. Lightweight with a bold interplay of golden and blue colours, these specs are for those who want to give their minimalist fashion sense a new meaning. Lenses shaped by hand (risk of human error)Prices vary depending on power of lensesNo warranty on lenses50% higher prices than Lenskart (on average)Limited selection of frames in stockLenses shaped by laser precision machinesSame price no matter what your power1 year warranty on all lenses50% lower prices than local optician (on average)5,000 frames in stock in a range of styles and brands'",41,127,Golden Blue
76,VO4131Golden Black,Vogue VO4131 Small (Size-48) Golden Black 280 Women Eyeglasses ,Vogue,Eyeglasses,5990,4792,Full Rim,Women,Hexagonal,"b'These Vogue VO4131 Small (Size-48) Golden Black 280 Women Eyeglasses come with unique detailing on their hexagonal frames. Lightweight with a bold interplay of golden and black colours, these specs are for those who want to give their minimalist fashion sense a new meaning. Lenses shaped by hand (risk of human error)Prices vary depending on power of lensesNo warranty on lenses50% higher prices than Lenskart (on average)Limited selection of frames in stockLenses shaped by laser precision machinesSame price no matter what your power1 year warranty on all lenses50% lower prices than local optician (on average)5,000 frames in stock in a range of styles and brands'",41,128,Golden Black
77,VO4125Brown,Vogue VO4125 Medium (Size-51) Brown Purple Brown 5115 Women Eyeglasses ,Vogue,Eyeglasses,3890,3112,Full Rim,Women,Cat Eye,"b'These trendy Vogue VO4125 Medium (Size-51) Brown Purple Brown 5115 Women Eyeglasses will raise your minimalist style quotient. Drawing from oval spectacles design, these cat-eye frames will complement both casuals and professional outfits.Lenses shaped by hand (risk of human error)Prices vary depending on power of lensesNo warranty on lenses50% higher prices than Lenskart (on average)Limited selection of frames in stockLenses shaped by laser precision machinesSame price no matter what your power1 year warranty on all lenses50% lower prices than local optician (on average)5,000 frames in stock in a range of styles and brands'",42,132,Brown
78,VO5055Black,Vogue VO5055 Medium (Size-51) Black 2385 Women Eyeglasses ,Vogue,Eyeglasses,5290,3703,Full Rim,Women,Butterfly,"b""Remember your sexy librarian who donned smart optics, making the library the favourite spot for students? Vogue VO5055 Size:51 Black 2385 Women's Eyeglasses having a stunning silhouette that will lend you a similar style, one that everyone will remember for years to come.Lenses shaped by hand (risk of human error)Prices vary depending on power of lensesNo warranty on lenses50% higher prices than Lenskart (on average)Limited selection of frames in stockLenses shaped by laser precision machinesSame price no matter what your power1 year warranty on all lenses50% lower prices than local optician (on average)5,000 frames in stock in a range of styles and brands""",40,137,Black
79,VO5204Golden Brown,Vogue VO5204 Medium (Size-52) Tortoise Golden Brown W656 Women Eyeglasses ,Vogue,Eyeglasses,4090,3272,Full Rim,Women,Cat Eye,"b'When you wish to look sassy with cat-eye tortoise frames, follow Jennifer Aniston. Vogue VO5204 Medium (Size-52) Tortoise Golden Brown W656 Women Eyeglasses paired with all-black outfits and a high ponytail are sure to make peers envious! The golden temples make the pair versatile enough to wear on any occasion. Lenses shaped by hand (risk of human error)Prices vary depending on power of lensesNo warranty on lenses50% higher prices than Lenskart (on average)Limited selection of frames in stockLenses shaped by laser precision machinesSame price no matter what your power1 year warranty on all lenses50% lower prices than local optician (on average)5,000 frames in stock in a range of styles and brands'",38,124,Golden Brown
80,TH6198Golden Brown,Tommy Hilfiger TH6198 Large (Size-55) Golden Brown C4 Unisex Eyeglasses ,Tommy Hilfiger,Eyeglasses,9000,7200,Full Rim,Unisex,Square,"b'Tommy Hilfiger TH6198 Large (Size-55) Golden Brown C4 Unisex EyeglassesLenses shaped by hand (risk of human error)Prices vary depending on power of lensesNo warranty on lenses50% higher prices than Lenskart (on average)Limited selection of frames in stockLenses shaped by laser precision machinesSame price no matter what your power1 year warranty on all lenses50% lower prices than local optician (on average)5,000 frames in stock in a range of styles and brands'",45,134,Golden Brown
81,TH6147Tortoise,Tommy Hilfiger TH6147 Large (Size-52) Tortoise C4 Unisex Eyeglasses ,Tommy Hilfiger,Eyeglasses,8700,6960,Full Rim,Unisex,Square,"b'Tommy Hilfiger TH6147 Large (Size-52) Tortoise C4 Unisex EyeglassesLenses shaped by hand (risk of human error)Prices vary depending on power of lensesNo warranty on lenses50% higher prices than Lenskart (on average)Limited selection of frames in stockLenses shaped by laser precision machinesSame price no matter what your power1 year warranty on all lenses50% lower prices than local optician (on average)5,000 frames in stock in a range of styles and brands'",43,,Tortoise
82,TH3201Green Transparent,Tommy Hilfiger TH3201 Small (Size-51) Gunmetal Green Transparent C5 Unisex Eyeglasses ,Tommy Hilfiger,Eyeglasses,6700,5360,Full Rim,Unisex,Aviator,"b'Tommy Hilfiger TH3201 Small (Size-51) Gunmetal Green Transparent C5 Unisex EyeglassesLenses shaped by hand (risk of human error)Prices vary depending on power of lensesNo warranty on lenses50% higher prices than Lenskart (on average)Limited selection of frames in stockLenses shaped by laser precision machinesSame price no matter what your power1 year warranty on all lenses50% lower prices than local optician (on average)5,000 frames in stock in a range of styles and brands'",42,,Green Transparent
